{
  "$schema": "https://json-schema.org/draft/2020-12/schema",
  "$id": "https://github.com/safal207/DIF/schemas/human-response-state.schema.json",
  "title": "DIF Human Response Receipt",
  "description": "A provenance-preserving receipt for structured human questions. Semantic state/authority invariants are enforced by tools/validate_human_response.py.",
  "type": "object",
  "additionalProperties": false,
  "required": [
    "schema_version",
    "question_id",
    "response_state",
    "selected_option",
    "decision_source",
    "human_interaction_observed",
    "human_confirmed",
    "agent_authority",
    "observed_at"
  ],
  "properties": {
    "schema_version": {
      "const": "0.1"
    },
    "question_id": {
      "type": "string",
      "minLength": 1
    },
    "response_state": {
      "type": "string",
      "enum": [
        "PENDING",
        "ANSWERED_BY_USER",
        "DECLINED_OPTIONS",
        "DEFERRED_BY_USER",
        "DELEGATED_TO_AGENT",
        "TIMED_OUT",
        "DISMISSED",
        "CONNECTION_LOST",
        "CANCELLED_BY_SYSTEM"
      ]
    },
    "selected_option": {
      "type": [
        "string",
        "null"
      ],
      "minLength": 1
    },
    "decision_source": {
      "type": "string",
      "enum": [
        "HUMAN",
        "AGENT",
        "SYSTEM",
        "TRANSPORT"
      ]
    },
    "human_interaction_observed": {
      "type": "boolean"
    },
    "human_confirmed": {
      "type": "boolean"
    },
    "agent_authority": {
      "type": "string",
      "enum": [
        "CONTINUE",
        "CHOOSE",
        "ASK_FOLLOWUP",
        "STOP_AND_WAIT"
      ]
    },
    "observed_at": {
      "type": "string",
      "format": "date-time"
    },
    "session_id": {
      "type": [
        "string",
        "null"
      ],
      "minLength": 1
    },
    "transport_id": {
      "type": [
        "string",
        "null"
      ],
      "minLength": 1
    },
    "metadata": {
      "type": "object"
    }
  }
}
