{
  "schema_version": "0.1",
  "question_id": "q-connection",
  "response_state": "CONNECTION_LOST",
  "selected_option": null,
  "decision_source": "TRANSPORT",
  "human_interaction_observed": false,
  "human_confirmed": false,
  "agent_authority": "STOP_AND_WAIT",
  "observed_at": "2026-07-15T20:00:00Z"
}
