{
  "schema_version": "0.1",
  "question_id": "q-user-selected",
  "response_state": "ANSWERED_BY_USER",
  "selected_option": "option-b",
  "decision_source": "HUMAN",
  "human_interaction_observed": true,
  "human_confirmed": true,
  "agent_authority": "CONTINUE",
  "observed_at": "2026-07-15T20:00:00Z"
}
